character_name	alternate_name	include	hits	cancel_types	guard_type	description	official_name	sort_order	combo_type	content	conditions	tag_list	damage_data.damage	damage_data.damage_formula	damage_data.life_point_damage	damage_data.chip_damage	damage_data.chip_damage_formula	damage_data.stun_damage	damage_data.stun_damage_formula	frame_data.startup_frames	frame_data.startup_frames_formula	frame_data.active_frames	frame_data.active_frames_formula	frame_data.active_until_landing	frame_data.whiff_recovery_frames	frame_data.whiff_recovery_frames_formula	frame_data.hit_frame_advantage	frame_data.hit_frame_advantage_formula	frame_data.block_frame_advantage	frame_data.block_frame_advantage_formula	frame_data.crouching_hit_frame_advantage	frame_data.crouching_hit_frame_advantage_formula	meter_data.meter_cost	meter_data.meter_cost_formula	meter_data.whiff_meter_build	meter_data.whiff_meter_build_formula	meter_data.block_meter_build	meter_data.block_meter_build_formula	meter_data.hit_meter_build	meter_data.hit_meter_build_formula	meter_data.parry_meter_build	meter_data.parry_meter_build_formula	metadata
Remy	Light of Virtue (Punch)	TRUE		Super	Any	The traditional Sonic Boom, in a game where you can parry sonic booms. Just like Guile, Remy's Sonic Boom is the best meterless projectile in the game, with lightning fast recovery and great frame advantage. It's so fast that someone could reaction super through your fireballs and you would still have enough time to smack them with a super 2 afterwards. You can set up a meaty Sonic Boom (*ahem* Light of Virtue) very easily after a knockdown for obnoxious kara throw mixups, kara UOH, low Short, pokes, or whatever else you want to subject your opponent to depending on the character. The high version can unfortunately be crouched by most characters (except Q and Hugo, in which matchups this move is incredibly obnoxious). This move also synergizes very well with Remy's great forward dash or a spaced Cold Blue Kick to quickly approach with a Sonic Boom in front.		510	Special	[4]+6+P		charge, projectile	60		10	4		3		N/A		2			33		6		5		7				0		1		1		4		{"Parry":"H","Juggle Value":"7","Reset or Juggle":"Reset"}
Remy	Light of Virtue (LP)	FALSE		Super	Any	The traditional Sonic Boom, in a game where you can parry sonic booms. Just like Guile, Remy's Sonic Boom is the best meterless projectile in the game, with lightning fast recovery and great frame advantage. It's so fast that someone could reaction super through your fireballs and you would still have enough time to smack them with a super 2 afterwards. You can set up a meaty Sonic Boom (*ahem* Light of Virtue) very easily after a knockdown for obnoxious kara throw mixups, kara UOH, low Short, pokes, or whatever else you want to subject your opponent to depending on the character. The high version can unfortunately be crouched by most characters (except Q and Hugo, in which matchups this move is incredibly obnoxious). This move also synergizes very well with Remy's great forward dash or a spaced Cold Blue Kick to quickly approach with a Sonic Boom in front.	Light of Virtue (LP)	511	Special	[4]+6+LP		charge, projectile	60	-	10	4	-	3	-	8	-	1	-	-	22	-	6	-	5	-	7	-	-	-	0	-	1	-	1	-	4	-	{"Parry":"H","Juggle Value":"7","Reset or Juggle":"Reset"}
Remy	Light of Virtue (MP)	FALSE		Super	Any	The traditional Sonic Boom, in a game where you can parry sonic booms. Just like Guile, Remy's Sonic Boom is the best meterless projectile in the game, with lightning fast recovery and great frame advantage. It's so fast that someone could reaction super through your fireballs and you would still have enough time to smack them with a super 2 afterwards. You can set up a meaty Sonic Boom (*ahem* Light of Virtue) very easily after a knockdown for obnoxious kara throw mixups, kara UOH, low Short, pokes, or whatever else you want to subject your opponent to depending on the character. The high version can unfortunately be crouched by most characters (except Q and Hugo, in which matchups this move is incredibly obnoxious). This move also synergizes very well with Remy's great forward dash or a spaced Cold Blue Kick to quickly approach with a Sonic Boom in front.	Light of Virtue (MP)	512	Special	[4]+6+MP		charge, projectile	60	-	10	4	-	3	-	9	-	1	-	-	22	-	6	-	5	-	7	-	-	-	0	-	1	-	1	-	4	-	{"Parry":"H","Juggle Value":"7","Reset or Juggle":"Reset"}
Remy	Light of Virtue (HP)	FALSE		Super	Any	The traditional Sonic Boom, in a game where you can parry sonic booms. Just like Guile, Remy's Sonic Boom is the best meterless projectile in the game, with lightning fast recovery and great frame advantage. It's so fast that someone could reaction super through your fireballs and you would still have enough time to smack them with a super 2 afterwards. You can set up a meaty Sonic Boom (*ahem* Light of Virtue) very easily after a knockdown for obnoxious kara throw mixups, kara UOH, low Short, pokes, or whatever else you want to subject your opponent to depending on the character. The high version can unfortunately be crouched by most characters (except Q and Hugo, in which matchups this move is incredibly obnoxious). This move also synergizes very well with Remy's great forward dash or a spaced Cold Blue Kick to quickly approach with a Sonic Boom in front.	Light of Virtue (HP)	513	Special	[4]+6+HP		charge, projectile	60	-	10	4	-	3	-	10	-	1	-	-	22	-	6	-	5	-	7	-	-	-	0	-	1	-	1	-	4	-	{"Parry":"H","Juggle Value":"7","Reset or Juggle":"Reset"}
Remy	Light of Virtue (Kick)	TRUE		Super	Low	Sagat much? While the high Sonic Boom has better frame advantage and startup, the low Sonic Boom has the incredible plus of both being a low and hitting crouching opponents. The only options an opponent has against it are blocking it, parrying it, jumping out of the way, or supering through it. Additionally, since the low and high Sonic Booms are different projectiles, you can have one of each on the screen at any one time.		520	Special	[4]+6+K		charge, projectile	60		10	4		3		N/A		1			22		2		1		3				0		1		1		4		{"Parry":"L","Juggle Value":"7","Reset or Juggle":"Reset"}
Remy	Light of Virtue (LK)	FALSE		Super	Low	Sagat much? While the high Sonic Boom has better frame advantage and startup, the low Sonic Boom has the incredible plus of both being a low and hitting crouching opponents. The only options an opponent has against it are blocking it, parrying it, jumping out of the way, or supering through it. Additionally, since the low and high Sonic Booms are different projectiles, you can have one of each on the screen at any one time.	Light of Virtue (LK)	521	Special	[4]+6+LK		charge, projectile	60	-	10	4	-	3	-	10	-	1	-	-	22	-	2	-	1	-	3	-	-	-	0	-	1	-	1	-	4	-	{"Parry":"L","Juggle Value":"7","Reset or Juggle":"Reset"}
Remy	Light of Virtue (MK)	FALSE		Super	Low	Sagat much? While the high Sonic Boom has better frame advantage and startup, the low Sonic Boom has the incredible plus of both being a low and hitting crouching opponents. The only options an opponent has against it are blocking it, parrying it, jumping out of the way, or supering through it. Additionally, since the low and high Sonic Booms are different projectiles, you can have one of each on the screen at any one time.	Light of Virtue (MK)	522	Special	[4]+6+MK		charge, projectile	60	-	10	4	-	3	-	11	-	1	-	-	22	-	2	-	1	-	3	-	-	-	0	-	1	-	1	-	4	-	{"Parry":"L","Juggle Value":"7","Reset or Juggle":"Reset"}
Remy	Light of Virtue (HK)	FALSE		Super	Low	Sagat much? While the high Sonic Boom has better frame advantage and startup, the low Sonic Boom has the incredible plus of both being a low and hitting crouching opponents. The only options an opponent has against it are blocking it, parrying it, jumping out of the way, or supering through it. Additionally, since the low and high Sonic Booms are different projectiles, you can have one of each on the screen at any one time.	Light of Virtue (HK)	523	Special	[4]+6+HK		charge, projectile	60	-	10	4	-	3	-	12	-	1	-	-	22	-	2	-	1	-	3	-	-	-	0	-	1	-	1	-	4	-	{"Parry":"L","Juggle Value":"7","Reset or Juggle":"Reset"}
Remy	Light of Virtue (Punch) (EX)	TRUE	2	Super	Any	Frame Data	Light of Virtue (EX)	531	Special	[4]+6+PP		charge, projectile, ex	120	-	20	8	8(4+4)	6	6(3+3)	7	7/8*	1	-	-	23	-	5	-	4	-	6	-	40	-	0	-	0	-	0	-	8	-	{"Parry":"H","Juggle Value":"14 (7+7)","Reset or Juggle":"Juggle"}
Remy	Light of Virtue (Kick) (EX)	TRUE	2	Super	Any	Frame Data	Light of Virtue (EX)	532	Special	[4]+6+KK		charge, projectile, ex	120	-	20	8	8(4+4)	6	6(3+3)	8	7/8*	1	-	-	27	-	1	-	4	-	2	-	40	-	0	-	0	-	0	-	8	-	{"Parry":"H","Juggle Value":"14 (7+7)","Reset or Juggle":"Juggle"}
Remy	Cold Blue Kick	TRUE		-	Any		Cold Blue Kick	540	Special	214+K		-	120		21	15		7							10										3		12		18		4		{"Parry":"H","Juggle Value":"2","Reset or Juggle":"Juggle"}
Remy	Cold Blue Kick (LK)	FALSE		-	Any	Since this is Remy's only special move that can be done without charge, it's important in his kit. When properly spaced, it's safe on block with little recovery. Don't just throw out this move to approach for free, though, since it can be reaction parried if it hits later. The roundhouse version jumps over cornered opponents and knocks down on hit, so it can potentially be used as a corner escape and as a pre-emptive anti air. In the corner, you can juggle into a short Cold Blue Kick to extend juggles, leading to the cool-looking, iconic and useful cr.HP -> LK Cold Blue Kick -> HK Flash Kick.	Cold Blue Kick (LK)	541	Special	214+LK		-	120	-	21	15	-	7	-	17	-	12	-	-	10	-	-	-4/+5 low	-	-4/+5 low	-	-4/+5 low	-	-	3	-	12	-	18	-	4	-	{"Parry":"H","Juggle Value":"2","Reset or Juggle":"Juggle"}
Remy	Cold Blue Kick (MK)	FALSE		-	Any	Since this is Remy's only special move that can be done without charge, it's important in his kit. When properly spaced, it's safe on block with little recovery. Don't just throw out this move to approach for free, though, since it can be reaction parried if it hits later. The roundhouse version jumps over cornered opponents and knocks down on hit, so it can potentially be used as a corner escape and as a pre-emptive anti air. In the corner, you can juggle into a short Cold Blue Kick to extend juggles, leading to the cool-looking, iconic and useful cr.HP -> LK Cold Blue Kick -> HK Flash Kick.	Cold Blue Kick (MK)	542	Special	214+MK		-	120	-	21	15	-	7	-	18	-	12	-	-	10	-	-	-4/+5 low	-	-4/+5 low	-	-4/+5 low	-	-	3	-	12	-	18	-	4	-	{"Parry":"H","Juggle Value":"2","Reset or Juggle":"Juggle"}
Remy	Cold Blue Kick (HK)	FALSE		-	Any	Since this is Remy's only special move that can be done without charge, it's important in his kit. When properly spaced, it's safe on block with little recovery. Don't just throw out this move to approach for free, though, since it can be reaction parried if it hits later. The roundhouse version jumps over cornered opponents and knocks down on hit, so it can potentially be used as a corner escape and as a pre-emptive anti air. In the corner, you can juggle into a short Cold Blue Kick to extend juggles, leading to the cool-looking, iconic and useful cr.HP -> LK Cold Blue Kick -> HK Flash Kick.	Cold Blue Kick (HK)	543	Special	214+HK		hard knockdown	120	-	21	15	-	7	-	19	-	10	-	-	10	-	-	-	-	-6/+5 low	-	-	-	-	3	-	12	-	18	-	4	-	{"Parry":"H","Juggle Value":"2","Reset or Juggle":"Juggle"}
Remy	Cold Blue Kick (EX)	TRUE	2	-	Any	Generally useless. It doesn't do anything that the normal versions don't already do besides being 2 hits (which is a pretty easy reaction to make considering Remy flashes yellow). It can be used as a niche 2-hit anti-air, but Remy already has plenty of options on that front. At least it gets both of its hits as an anti-air.	Cold Blue Kick (EX)	545	Special	214+KK		hard knockdown, ex	160	-	27	20	20(11+9)	12	12(7+5)	18	-	9	-	-	10	-	N/A	-	-	-2/+5 low	N/A	-	40	-	0	-	0	-	0	-	8	8(4+4)	{"Parry":"Hx2","Juggle Value":"2(1+1)","Reset or Juggle":"Juggle"}
Remy	Rising Rage Flash	TRUE		-	Any		Rising Rage Flash	550	Special	[2]+8+K		hard knockdown, charge															N/A				N/A				3		12		17		4		{"Parry":"HL","Juggle Value":"15","Reset or Juggle":"Juggle"}
Remy	Rising Rage Flash (LK)	FALSE		-	Any	This move functions pretty much the same as a standard flash kick - big anti-air hitbox and awful on block. Since it requires charge, it's not always available as an anti-air, and even when it is the opponent could parry it for a big punish, so it's not a free win. Its primary purpose is using the HK version as a combo ender and very occasionally linking into the LK version off of a spaced UOH.	Rising Rage Flash (LK)	551	Special	[2]+8+LK		hard knockdown, charge	120	-	21	15	-	9	-	3	-	3	-	-	32	-	N/A	-	-17	-	N/A	-	-	-	3	-	12	-	17	-	4	-	{"Parry":"HL","Juggle Value":"15","Reset or Juggle":"Juggle"}
Remy	Rising Rage Flash (MK)	FALSE		-	Any	This move functions pretty much the same as a standard flash kick - big anti-air hitbox and awful on block. Since it requires charge, it's not always available as an anti-air, and even when it is the opponent could parry it for a big punish, so it's not a free win. Its primary purpose is using the HK version as a combo ender and very occasionally linking into the LK version off of a spaced UOH.	Rising Rage Flash (MK)	552	Special	[2]+8+MK		hard knockdown, charge	130	-	23	8	-	7	-	4	-	3	-	-	39	-	N/A	-	-23	-	N/A	-	-	-	3	-	12	-	17	-	4	-	{"Parry":"HL","Juggle Value":"15","Reset or Juggle":"Juggle"}
Remy	Rising Rage Flash (HK)	FALSE		-	Any	This move functions pretty much the same as a standard flash kick - big anti-air hitbox and awful on block. Since it requires charge, it's not always available as an anti-air, and even when it is the opponent could parry it for a big punish, so it's not a free win. Its primary purpose is using the HK version as a combo ender and very occasionally linking into the LK version off of a spaced UOH.	Rising Rage Flash (HK)	553	Special	[2]+8+HK		hard knockdown, charge	140	-	24	9	-	7	-	5	-	4	-	-	44	-	N/A	-	-26	-	N/A	-	-	-	3	-	12	-	17	-	4	-	{"Parry":"HL","Juggle Value":"15","Reset or Juggle":"Juggle"}
Remy	Rising Rage Flash (EX)	TRUE	2	Super	Any	Completely invincible and functions as Remy's true reversal. If you're running SA1, you can cancel the first hit on block to make it safe, but that spends a lot of meter that Remy would much rather keep for EX Booms. Reversals are nice option to have considering some characters don't have any that aren't locked behind Supers, and can invalidate an opponent's wakeup game when properly placed.	Rising Rage Flash (EX)	555	Special	[2]+8+KK		hard knockdown, charge, ex	190	190(120+70)	32	28	28(24+4)	14	14(7+7)	6	-	5	-	-	41	-	N/A	-	-21	-	N/A	-	40	-	0	-	0	-	0	-	8	8(4+4)	{"Parry":"HLx2","Juggle Value":"7/15","Reset or Juggle":"Juggle/Juggle"}
Remy	Target Combo 1	TRUE	2	Special,Super	Any	Useless on grounded opponents, but serves as another 2-hit anti-air option select should the opponent parry the first hit.	Target Combo 1	2001	Target Combo	c.MK > HK		-	-	-	-	-	-	14	9+5	4	-	-	-	-	-	-	-7	-	-9	-	-5	-	-	11+1	-	2+?	7	6+1	12	11+1	8	8(4+4)	{"Parry":"H/H","Juggle Value":"15/15","Reset or Juggle":"Reset/Reset"}
Remy	Target Combo 2	TRUE	2	Self,Special,Super	Any	A very strange target combo that gives Remy better damage and versatility off of a close Jab anti-air as discussed previously. When point blank, close Jab xx close Jab xx close Short is a decent super confirm for both SA1 and SA2 (and is technically damage optimal for SA2), but is executionally difficult due to the fact that the close Short must be done while the stick is in the neutral position.	Target Combo 2	2002	Target Combo	c.LP > c.LK		multi hit	65	30+35	11	-	-	8	3+5	4	-	-	-	-	-	-	0	-	0	-	0	-	-	4(2+2)	-	0(0+0)	2	2(1+1)	4	4(2+2)	8	8(4+4)	{"Parry":"HL/HL","Juggle Value":"1/15","Reset or Juggle":"Reset/Reset"}
Remy	Taunt	FALSE	0	-	Any	-	-	001	Unique Mechanic	HP+HK		-	-	-	-	-	-	-	-	-	-	131	-	-	-	-	-	-	-	-	-	-	-	-	-	4(6)	-	-	-	-	8	8(4+4)	{"Parry":"HL"}
Remy	Universal Overhead	FALSE		-	Overhead	As far as UOHs go, Remy gets a good amount of use out of spaced/meaty UOH -> SA2, especially with a standing HK kara giving it a massive range boost. However, Remy suffers from a severe lack of reasons for the opponent to block or parry low, so it's not entirely in Remy's favor.	-	002	Universal Mechanic	MP+MK		-	-	-	-	-	-	3	-	15	-	10	-	-	5	-	-	0~+8	-	-5~+7	-	=+1~+9	-	-	0	-	1	-	2	-	4	-	{"Parry":"H","Juggle Value":"1","Reset or Juggle":"Reset"}
Remy	Nemuri wo Midasu Contour	TRUE		-	Throw Tech	Basic damage throw. Good in the corner against characters that need a kara flash kick, if you haven't mastered it.	Nemuri wo Midasu Contour	003	Universal Mechanic	4+LP+LK		-	130	-	23	-	-	5	-	2	-	1	-	-	21	-	-	-	-	-	-	-	-	-	0	-	-	7 (for the player who blocked)	8	-	-	-	{"Throw Range":"24","Kara-Throw":"Far S.HK / Far S.MP / F.MK / Close S.MP / Close S.LK / Close S.MK / Far S.HP / C.MK / C.HK / C.HP / Far S.LP","Kara-Throw Range":"51 / 45 / 40 / 38 / 36 / 36 / 33 / 32 / 31 / 30 / 25"}
Remy	Valse no you ni Kuruoshiku	TRUE		-	Throw Tech	Because Remy has few ways of dissuading parries, this throw is a godsend. It smacks the opponent fullscreen, and in the corner it allows you to juggle an HK flash kick (requires a st.MP kara on Twins, Ibuki, Dudley, and Oro) or even partial connects of SA1/SA2. His kara throw range is pretty nice as well.	Valse no you ni Kuruoshiku	004	Universal Mechanic	6+LP+LK		-	120	-	17	-	-	15	-	2	-	1	-	-	21	-	-	-	-	-	-	-	-	-	0	-	-	7 (for the player who blocked)	7	-	-	-	{"Throw Range":"24","Kara-Throw":"Far S.HK / Far S.MP / F.MK / Close S.MP / Close S.LK / Close S.MK / Far S.HP / C.MK / C.HK / C.HP / Far S.LP","Kara-Throw Range":"51 / 45 / 40 / 38 / 36 / 36 / 33 / 32 / 31 / 30 / 25","Juggle Value":"1","Reset or Juggle":"Juggle"}
Remy	Close Jab	TRUE		Special,Super	Any	Fast, low commitment anti-air that chains into itself, meaning you can keep mashing it if the opponent parries in the air. His close LP -> close LK TC will combo even when the opponent is airborne, which is a nice damage bonus to a very effective anti-air.	-	111	Proximity Normal	c.LP		-	30	-	5	-	-	3	-	4	-	4	-	-	3	-	3	-	3	-	3	-	-	-	0	-	1	-	2	-	4	-	{"Parry":"HL","Juggle Value":"1","Reset or Juggle":"Reset"}
Remy	Far Jab	TRUE		Self,Special,Super	Any	A standard quick punch with decent range and no combo applications. Useful as a low-commitment anti-air at ranges where close Jab doesn't activate as it is safe on air parry.	-	112	Proximity Normal	f.LP		-	30	-	3	-	-	3	-	4	-	4	-	-	4	-	3	-	3	-	3	-	-	-	0	-	1	-	2	-	4	-	{"Parry":"HL","Juggle Value":"15","Reset or Juggle":"Reset"}
Remy	Close Strong	TRUE		Special,Super	Any	Remy proceeds to roast the opponent with a BOI motion. Allows for links into cr. Short afterwards. Generally outclassed by close MK, but can be used in certain blockstrings due to its good frame advantage and low pushback.	-	121	Proximity Normal	c.MP		-	70	-	12	-	-	7	-	5	-	5	-	-	8	-	6	-	5	-	7	-	-	-	2	-	6	-	11	-	4	-	{"Parry":"H","Juggle Value":"15","Reset or Juggle":"Reset"}
Remy	Far Strong	TRUE		-	Any	Nice, high-angled strike with decent startup and good range, but poor damage. Good for anti-airs and as a poke against taller characters, but prone to being crouched.	-	122	Proximity Normal	f.MP		-	60	-	10	-	-	9	-	7	-	3	-	-	12	-	2	-	1	-	3	-	-	-	2	-	6	-	11	-	4	-	{"Parry":"H","Juggle Value":"15","Reset or Juggle":"Reset"}
Remy	Close Fierce	TRUE		Special,Super	Any	Remy's highest damage cancel by a good margin. However, it whiffs on crouching opponents and has disapointing range, making its applications in neutral somewhat limited. Its hitbox is very tall, potentially catching cross-up attempts if you didn't have time to charge a flash kick.	-	131	Proximity Normal	c.HP		-	130	-	21	-	-	15	-	6	-	3	-	-	15	-	0	-	-2	-	2	-	-	-	3	-	6	-	14	-	4	-	{"Parry":"H","Juggle Value":"15","Reset or Juggle":"Reset (Juggle at fist)"}
Remy	Far Fierce	TRUE		-	Any	Big punch with good damage, range, and priority. Pretty good as a poke and to build space with its large pushback.	-	132	Proximity Normal	f.HP		-	110	-	19	-	-	7	-	10	-	5	-	-	18	-	0	-	-2	-	2	-	-	-	3	-	10	-	19	-	4	-	{"Parry":"H","Juggle Value":"15","Reset or Juggle":"Reset"}
Remy	Close Short	TRUE		Special,Super	Any	Also tied for the fastest move in the game, this quick knee strike has very little utility outside of Remy's TC.	-	141	Proximity Normal	c.LK		-	35	-	6	-	-	5	-	2	-	5	-	-	7	-	0	-	0	-	0	-	-	-	0	-	1	-	2	-	4	-	{"Parry":"HL","Juggle Value":"15","Reset or Juggle":"Reset"}
Remy	Far Short	TRUE		-	Any	The almighty foot. You can land this as part of Remy's LP xx LK target combo, but the timing for this is difficult. Tied for one of the fastest normals in the game, strangely enough, and has a small disjoint near the tip of his foot. It's nothing to write home about, though it is a one-frame link into SA2.	-	142	Proximity Normal	f.LK		-	35	-	5	-	-	5	-	2	-	5	-	-	4	-	2	-	2	-	2	-	-	-	0	-	1	-	2	-	4	-	{"Parry":"HL","Juggle Value":"15","Reset or Juggle":"Reset"}
Remy	Close Forward	TRUE		Special,Super	Any	Now we finally reach a good normal! This is Remy's main damage hitconfirm a la SA2 (st.Forward -> SA2), which is important because Remy has very few safe confirms. Without it, Remy doesn't really have good damage options outside of his cr. Fierce.	-	151	Proximity Normal	c.MK		-	80	-	16	-	-	7	-	4	-	6	-	-	11	-	3	-	1	-	5	-	-	-	2	-	6	-	11	-	4	-	{"Parry":"H","Juggle Value":"15","Reset or Juggle":"Reset"}
Remy	Far Forward	TRUE		-	Any	A decent poke and OK counter-poke with good range, but little else.	-	152	Proximity Normal	f.MK		-	80	-	14	-	-	7	-	8	-	5	-	-	14	-	-2	-	-3	-	-1	-	-	-	2	-	6	-	11	-	4	-	{"Parry":"H","Juggle Value":"15","Reset or Juggle":"Reset"}
Remy	Amari ni Muku na Aiguille	TRUE		-	Overhead	While this is an overhead with good range, it has little else going for it - the startup is somewhat reactable (meaning opponents can potentially parry on reaction, depending on skill level) and it's pretty bad on hit/block, ending your turn and potentially opening the door for the opponent to punish you for it. Generally an HK kara universal overhead has a bit less range but accomplishes the same thing without being minus.	Amari ni Muku na Aiguille	153	Command Normal	6MK		-	80	-	-	-	-	3	-	18	-	3	-	-	20	-	-6	-	-7	-	-5	-	-	-	2	-	6	-	11	-	4	-	{"Parry":"H","Juggle Value":"15","Reset or Juggle":"Reset"}
Remy	Close Roundhouse	TRUE	2	Special,Super	Any	A 2-hit tall kick that allows links to SA2 afterwards. Sounds nice, until you remember that the first hit only comes out point blank, which is a shame because it also special cancels. Still, it can act as a decent anti-air for opponents only expecting one parry.	-	161	Proximity Normal	c.HK		multi hit	140	140(80+60)	23	-	-	16	16(7+9)	6	-	3	-	-	15	-	5	-	3	-	7	-	-	-	3	-	12	-	25	-	8	8(4+4)	{"Parry":"H","Juggle Value":"3/3","Reset or Juggle":"Reset/Reset"}
Remy	Far Roundhouse	TRUE		-	Any	Functions as a slower, beefier version of standing Strong. Good in anti-air scenarios with a high angled hitbox, but prone to air parries. Also OK as a poke against some taller characters like Hugo, but can be crouched.	-	162	Proximity Normal	f.HK		-	130	-	23	-	-	11	-	10	-	3	-	-	23	-	-7	-	-9	-	-5	-	-	-	3	-	10	-	19	-	4	-	{"Parry":"H","Juggle Value":"15","Reset or Juggle":"Reset"}
Remy	Crouch Jab	TRUE		Self,Special,Super	Any	cr.LP -> cr.LP -> flash kick is another one of Remy's confirms, but it's held back somewhat by the fact that cr.LP can be parried in any direction. Still, it IS a confirm. 3 cr.LPs -> flash kick is also a combo that requires no prior charge, but also requires you to be point blank.	-	210	Normal	2LP		-	30	-	3	-	-	3	-	5	-	2	-	-	7	-	2	-	2	-	2	-	-	-	0	-	1	-	2	-	4	-	{"Parry":"HL","Juggle Value":"15","Reset or Juggle":"Reset"}
Remy	Crouch Strong	TRUE		Special,Super	Any	Good range, but low damage. It's usually cancelled into LoV for pressure, but can also be parried in either direction. Not only does Remy have a hard time making them block low, but making them parry low is also difficult. Given that this is Remy's main cancel for extending combos and blockstrings, it's a rather nifty tool. It also has a very good anti-air hitbox, as if Remy didn't have enough of those.	-	220	Normal	2MP		-	55	-	9	-	-	5	-	5	-	5	-	-	11	-	-1	-	-2	-	0	-	-	-	2	-	6	-	11	-	4	-	{"Parry":"HL","Juggle Value":"15","Reset or Juggle":"Reset"}
Remy	Crouch Fierce	TRUE		-	Any	This move is the most basic and scary of all of Remy's anti-airs, since it allows juggles on hit. On grounded connects and when midscreen it gives you time to charge up a HK flash kick, which is Remy's max damage for close range parries. In the corner you can combo an short Cold Blue Kick before this for more damage. Be careful to switch up between anti-airs, as if this move is air parried you're eating a fat combo.	-	230	Normal	2HP		hard knockdown	100	-	17	-	-	9	-	9	-	5	-	-	18	-	N/A	-	-5	-	N/A	-	-	-	3	-	10	-	19	-	4	-	{"Parry":"HL","Juggle Value":"3","Reset or Juggle":"Juggle"}
Remy	Crouch Short	TRUE		Special,Super	Low	Very important, as it's the only way you can safely make the opponent fear a low in neutral, even though it has no confirming options, bad damage, and is 0 on hit/block. More like a nuisance than anything threatening. Still, strings like low Short xx low LoV and low Short xx Light of Justice are safe and make the opponent block their toes to avoid damage, although neither confirm.	-	240	Normal	2LK		-	30	-	5	-	-	3	-	3	-	4	-	-	7	-	0	-	0	-	0	-	-	-	0	-	1	-	2	-	4	-	{"Parry":"L","Juggle Value":"15","Reset or Juggle":"Reset"}
Remy	Crouch Forward	TRUE		-	Low	This would be a nice low poke if not for the fact that it's laughably minus. Most shotos can sweep this on reaction and most other characters can get free damage depending on spacing. Still, it's not worthless against characters with bad mid-range punish options, like Dudley, but it still ends your momentum.	-	250	Normal	2MK		-	60	-	10	-	-	3	-	8	-	5	-	-	18	-	-8	-	-9	-	-7	-	-	-	2	-	6	-	11	-	4	-	{"Parry":"L","Juggle Value":"15","Reset or Juggle":"Reset"}
