Remy	Crouch Roundhouse	TRUE	2	-	Low	Guile much? While a sweep for most characters is a risky but slightly more rewarding low, the risk-reward for Remy is definitely not in his favor. This is due to the fact that, on block, the two hits are not a true blockstring, allowing the opponent to blue parry the second hit on reaction. Not only that, but on hit you get little okizeme since you're stuck whiffing the second hit. It's not useless, but only pull this out if you are confident that the opponent isn't blocking low.	-	260	Normal	2HK		hard knockdown, multi hit	210	-	17	-	-	6	3+3	9	-	7	2/5	-	21	-	-	-	-11	-	-	-	-	-	3	-	20	-	22	-	4	-	{"Parry":"L","Juggle Value":"15","Reset or Juggle":"Juggle"}
Remy	Jump Jab	TRUE		-	Overhead	A rather meh move. Completely outclassed by jumping Strong.	-	310	Normal	j.LP		air only	40	-	7	-	-	7	-	4	-	20	-	-	-	-	-	-3～+7	-	-3～+7	-	=+3～+7	-	-	0	-	1	-	2	-	4	-	{"Parry":"H","Juggle Value":"3","Reset or Juggle":"Reset"}
Remy	Jump Strong	TRUE		-	Overhead	Remy smacks you with his clown fingers with a good amount of active frames. Can be used in air-to-airs or to tick throw, but is generally outclassed by jumping Fierce.	-	320	Normal	j.MP		air only	70	-	12	-	-	11	-	5	-	14	-	-	-	-	-	-3～+10	-	-3～+10	-	=+7～+10	-	-	2	-	6	-	11	-	4	-	{"Parry":"H","Juggle Value":"3","Reset or Juggle":"Reset"}
Remy	Jump Fierce	TRUE		-	Overhead	In 3S, meeting the opponent air-to-air is normally a safer option than grounded anti-airs since most air normals don't allow combos on airborne opponents. This blunt elbow strike is an exception to this and makes Remy's opponents want to parry way earlier in their jump arc than most other characters, which can open them up for Remy's myriad of other options. Generally you only have time for a flash kick once you land, but if you smack the opponent particularly high in their jump near the corner you can do a short or forward Cold Blue Kick first.	-	330	Normal	j.HP		air only	125	-	22	-	-	15	-	9	-	5	-	-	-	-	-	-2～+13	-	-2～+13	-	=+8～+13	-	-	3	-	10	-	19	-	4	-	{"Parry":"H","Juggle Value":"3","Reset or Juggle":"Juggle"}
Remy	Jump Short	TRUE		-	Overhead	Almost useless except for the fact that it is Remy's only cross-up. The cross-up box is so small that it doesn't really matter anyways.	-	340	Normal	j.LK		air only	50	-	8	-	-	5	-	4	-	14	-	-	-	-	-	-4～+7	-	-4～+7	-	=+1～+7	-	-	0	-	1	-	2	-	4	-	{"Parry":"H","Juggle Value":"3","Reset or Juggle":"Reset"}
Remy	Jump Forward	TRUE		-	Overhead	Good as a long range air-to-air.	-	350	Normal	j.MK		air only	90	-	16	-	-	9	-	6	-	4	-	-	-	-	-	-2～+10	-	-2～+10	-	=+7～+10	-	-	2	-	6	-	11	-	4	-	{"Parry":"H","Juggle Value":"3","Reset or Juggle":"Reset"}
Remy	Jump Roundhouse	TRUE		-	Overhead	The hitbox goes very low to the ground, making it hit characters looking to anti-air parry earlier than usual. It also hits most characters after an immediate neutral jump, making neutral jumps yet another potential anti-air in Remy's kit. This is your main jump-in normal alongside jumping Fierce.	-	360	Normal	j.HK		air only	120	-	21	-	-	13	-	10	-	4	-	-	-	-	-	-1～+13	-	-1～+13	-	=+7～+13	-	-	3	-	10	-	19	-	4	-	{"Parry":"H","Juggle Value":"3","Reset or Juggle":"Reset"}
Remy	Super Art 1	TRUE	7		Any	This super has 2 main advantages over Super 2. One is that it's completely safe on block with massive pushback, making it a valuable cancel from low Short. The second is that it's an incredibly obnoxious parry as an anti-air or on wake-up, making it good at shutting down characters like Dudley or Hugo who have a hard time without parries in those situations. It's pretty matchup dependent because against most characters Remy would rather take the burst damage and extra meter that Super 2 provides.	Light of Justice	1001	Super	236+236+P		projectile	320	(55x7)	52	56		21		1		7			24		4		3		5				0		0		0				{"Parry":"HLx7","Juggle Value":"7(1 per hit)","Reset or Juggle":"Jugglet"}
Remy	Super Art 2	TRUE	10		Any	This super gives Remy some nice confirming options into big damage like close Forward, close Jab xx close Jab xx close Short, and crouch Jab -> crouch Jab. Unfortunately, in juggles it loses half of its hits for some pitiful damage. It IS fast enough to hit someone out of a JP 15 air reset, meaning you can cancel any normal on air hit into it. It hits on air resets, so close Jab or any air-to-air jumping normal into SA2 is possible, though the opponent could theoretically parry out. It's a one frame parry after the freeze, so that is nightmarishly hard. Besides the super itself, it also gives Remy the most meter out of all his supers, stocking a total of 6 EX moves in the back pocket.	Supreme Rising Rage Flash	1002	Super	236+236+K		hard knockdown	390	(100+40+40+60+30+30+40+40+40+80)	61	77	(13+10+10+8+4+4+6+6+6+10)	0			(1,2,3,20,21,22,43,45,47,49)49		1×6+2×3+5				N/A		-80		N/A				0		0		0				{"Parry":"HLx10","Juggle Value":"0, 15 on last hit","Reset or Juggle":"Jugglet"}
Remy	Super Art 3	TRUE	7		Any	Hilariously bad, Blue Nocturne is by and away the worst super in the entire game. It's a counter super, meaning that the opponent has to hit you after the super freeze to activate. So anytime you activate this outside of confirming it (easier said than done), the opponent could just...you know... not hit it and get a full jump in combo on Remy. The ONLY WAY to get this off in a real match is to parry a multihit attack and then activate, which is incredibly specific. Or you could pick SA2 and do close Forward -> SA2 or raw SA2 after a multihit parry instead.	Blue Nocturne	1003	Super	236+236+K		hard knockdown	465		75	N/A		21		1		21			39		N/A		-21		N/A				0		0		0				{"Parry":"HLx7","Juggle Value":"1 per hit, 3 on last hit","Reset or Juggle":"Reset, Juggle on last hit"}